Authentication-Results: prod-smtp-forward02;
	dkim=pass header.i=@digitalocean.com header.d=digitalocean.com header.s=google
Received: from mail-io1-f69.google.com (mail-io1-f69.google.com [209.85.166.69])
	by prod-smtp-forward02 (Haraka) with ESMTPS id DEEBE84E-53AE-408B-8516-5FE5DED221CC.1
	envelope-from <abuse+bncBCQ654E3ZEBBBYGEZGXAMGQEAGLWSTQ@digitalocean.com>
	tls TLS_AES_256_GCM_SHA384;
	Sun, 18 Feb 2024 20:02:41 +0000
Received: by mail-io1-f69.google.com with SMTP id ca18e2360f4ac-7c74d3ab389sf29800839f.1
        for <abuse@digitalocean.abusehq.net>; Sun, 18 Feb 2024 12:02:41 -0800 (PST)
ARC-Seal: i=2; a=rsa-sha256; t=1708286560; cv=pass;
        d=google.com; s=arc-20160816;
        b=0BGrAMWa6mw7/J4o74cIowt82vWx8/TqSLDu2zFIlJO3v1QhpHPs0c+bLwIX4m6MsI
         zH2guo/bOuXi1Fq2BssaroTNrRCIKxAq7ETdVBl0Uu/A9VKQSF7AjABkstBZ41OpJLSe
         f264B0Okvy/vMta9wqNOlE5qJj41EanJlheZsPftza2DX7UajS3QgIbX5K5QxSKYT0YL
         9sNuEBEUu/jQHN1zy2MaIN7lTYUJYjF0H+eQGBOktxK5EG129qdGlPLPt9Zcc+0DVWx4
         e6mZomiWR8IBFq29dpyXgZKU6J5kL0wLgIz9hQcC4Zfhl2CZengc001u91OcFE34XJ4c
         L2qA==
ARC-Message-Signature: i=2; a=rsa-sha256; c=relaxed/relaxed; d=google.com; s=arc-20160816;
        h=list-unsubscribe:list-archive:list-help:list-post:list-id
         :mailing-list:precedence:message-id:date:user-agent:subject:to:from
         :mime-version:sender:dkim-signature;
        bh=aej2CetmarKURvCpTQtBIBt5mDTSo07LRfKhV3PgHuI=;
        fh=HyFOU5bb3Lt5yQdItPLN+A7zx0EJwVngmWo+UnH2MfA=;
        b=maBFYD6mUzHySMkodnD4eROYXRQIEbDWmRnossRAXelfA5c7579P0FJncqwmW7ijjn
         /dsXyD1xTiYJotG/5ZgWkO4O+UH0ikQ/2v3Z6l7GQ9k+pd5joPyaBa+KnL/oAyKMyxki
         zYJwrHAQroXs18qoZwWI7XP5NDNebnm1b1FaZHJTRvLeHHg2hvh0IA1UticDCG0+pnqO
         TdQEW9q74yza11vyx3w5vpJ6UkoYF8PjODGHL3jt0C2Uju3bp+/OsbX//rdOqypBJQ2R
         jlb+I1gDEUPALAp63B2LVN+A2UmVFfNPjgc+PBu5i37gDU1RobM3KaoSsV2C5SOwbKY/
         z0sQ==;
        darn=digitalocean.abusehq.net
ARC-Authentication-Results: i=2; mx.google.com;
       spf=pass (google.com: domain of mig@mirrorimagegaming.com designates 143.198.55.208 as permitted sender) smtp.mailfrom=mig@mirrorimagegaming.com
DKIM-Signature: v=1; a=rsa-sha256; c=relaxed/relaxed;
        d=digitalocean.com; s=google; t=1708286560; x=1708891360; darn=digitalocean.abusehq.net;
        h=list-unsubscribe:list-archive:list-help:list-post:list-id
         :mailing-list:precedence:x-original-authentication-results
         :x-original-sender:message-id:date:user-agent:subject:to:from
         :mime-version:sender:from:to:cc:subject:date:message-id:reply-to;
        bh=aej2CetmarKURvCpTQtBIBt5mDTSo07LRfKhV3PgHuI=;
        b=GPmxZySEHzx/d7hoq10mmhPEPVUSNnc4t7ikeeYLFnqYeZYqMoxZ6G/AtdCSPQlX8N
         +kXh7LDvKanNCWI9OD7Zw+ZLB1puPYA0/UNjQ8b/dXiybpiqyP7NcF7U6dIKN/3eUu9v
         DlDi2wvGb+w/QA8RSclN6pA1ZAg7MQQSizCVQ=
X-Google-DKIM-Signature: v=1; a=rsa-sha256; c=relaxed/relaxed;
        d=1e100.net; s=20230601; t=1708286560; x=1708891360;
        h=list-unsubscribe:list-archive:list-help:list-post
         :x-spam-checked-in-group:list-id:mailing-list:precedence
         :x-original-authentication-results:x-original-sender:message-id:date
         :user-agent:subject:to:from:x-beenthere:mime-version
         :x-gm-message-state:sender:from:to:cc:subject:date:message-id
         :reply-to;
        bh=aej2CetmarKURvCpTQtBIBt5mDTSo07LRfKhV3PgHuI=;
        b=RFuRIoHViXaFQvZtXFcleCWirkvMgi/rvdz4hpHwhLAMLd1NCk5ZU+MBSCoDSx9BvZ
         3x+6PGBBJxI52et0jZ3f5Ig3DHNtc0xk872y+GBxAPnWL3qzJ+2sElU/Ga7uPAkMuiMD
         oqCT5CDIj6fOgtBq88SynwXJ3P4bFllcy9YVpn3E0R49NBvoRLZZVPPQMzNyLWUyVlyS
         Ogm+ixyHQnlA7si2A4IaiGYhimk28BIVgKFDT+Zfm4Vbrqcja5sp85lMUnDcqlM5yRC+
         9waJbllZn3TjBGIazkVGOP76OF3T6OcBTUY12jd28lcWZm1FjLzVW2Dv52jKTCc6hJ3U
         fnOw==
Sender: abuse@digitalocean.com
X-Forwarded-Encrypted: i=2; AJvYcCWkhG1zyfvY8hSu6gj1v2uruTACoZbygR/zR9GXhVIDE86A5t5/ZmPmaZErxblPG1lwKKbShK8nbnlw9as97PkQqVAfq2L8kKKctpCQqRQ=
X-Gm-Message-State: AOJu0Yz4cPLcK/wQ+ZtMM4bpveRvd2wzx48OAIggqSJjLKqAJPhvnmuO
	p0OmDZp0tcIbElzKqcfGCKFFYd/h8eL85wOGGjcPEFcYzupGqyNfbbsiaHcgg10=
X-Google-Smtp-Source: AGHT+IEzgXAa5jRjhObxDivdqIbbafJFi0IpQLfGaK3jbsjb6N+fZ+iZxThReCwc+FFL+rFXfPe0+Q==
X-Received: by 2002:a05:6e02:1292:b0:363:da36:f643 with SMTP id y18-20020a056e02129200b00363da36f643mr8050965ilq.8.1708286560600;
        Sun, 18 Feb 2024 12:02:40 -0800 (PST)
MIME-Version: 1.0
X-BeenThere: abuse@digitalocean.com
Received: by 2002:a05:6e02:198d:b0:364:f794:ec3c with SMTP id
 g13-20020a056e02198d00b00364f794ec3cls2021957ilf.1.-pod-prod-02-us; Sun, 18
 Feb 2024 12:02:40 -0800 (PST)
X-Received: by 2002:a92:c705:0:b0:364:2447:469f with SMTP id a5-20020a92c705000000b003642447469fmr6428227ilp.31.1708286559769;
        Sun, 18 Feb 2024 12:02:39 -0800 (PST)
ARC-Seal: i=1; a=rsa-sha256; t=1708286559; cv=none;
        d=google.com; s=arc-20160816;
        b=s+raqoKNE9apCRoc7SUKLo4hZpAlvxj22SUaBnI2bdCXaVNWqPECZ5Swf9Qyjnzw0W
         u/JoVS2wLcV7GypNFbG735hBUZQLqMm/wRH6Nm7VV+5NJ4WhwUVDmAiMoLAD3ilfWkCg
         ruZ65odXCcxLKB9cfa/rVPAsEkXh2mRVS3E3zhRN/HEcvD6dhfOR/jnm7Ixm0+YqRZT1
         U7Up87+vq25F3FpKse3ef7ezpiD37E3mgy8zBlIvA7CZQHS+eefaS0VubgAEHDVf0u9A
         eyvB1qKibbLlNeiAuNTonqiHRkjbVJyqIZdZgFJzt9i6PCX//AENcRliJgCu3/MnaY/A
         nddQ==
ARC-Message-Signature: i=1; a=rsa-sha256; c=relaxed/relaxed; d=google.com; s=arc-20160816;
        h=message-id:date:user-agent:subject:to:from;
        bh=aej2CetmarKURvCpTQtBIBt5mDTSo07LRfKhV3PgHuI=;
        fh=pQAZtLKqoVxo3q77SRXxVUuXER3rvc9qBYUm7Y+XGEI=;
        b=yRyftpT3xlm6bRT1p+bwLEa8oV6ItPQqqdcGJ51OgYUPtIMG6HabJy3wqXTNNxFXkS
         +w7vWl7lMmiRQ8J8F76LESE8zXtdPnqp22oyUfrPPLsm82jloVGfzZ8qTGsdZ7jMoYTN
         /nh5pGCQXbV3+++1jlHTaFMhR45Ed2aDrMPG6yjnIbNK4+/9BdOd/ET4Wp67GulZYDbn
         0j5GAQUja5ZTY1j5M1b6EymwcnrQWmroqwnCfo/6SykRa5lLXPZ/gS0M8Hhndf9ETFZ0
         NveKQS8vNWh+BhEBt2NpmxotO+X+oK11SIV2tjWEOorGgQ7yKAiRkiAIMNjg4kBdlusI
         PdZQ==;
        dara=google.com
ARC-Authentication-Results: i=1; mx.google.com;
       spf=pass (google.com: domain of mig@mirrorimagegaming.com designates 143.198.55.208 as permitted sender) smtp.mailfrom=mig@mirrorimagegaming.com
Received: from mail.mirrorimagegaming.com (mail.mirrorimagegaming.com. [143.198.55.208])
        by mx.google.com with ESMTPS id n19-20020a638f13000000b005dc83423faasi3200008pgd.833.2024.02.18.12.02.39
        for <abuse@digitalocean.com>
        (version=TLS1_3 cipher=TLS_AES_256_GCM_SHA384 bits=256/256);
        Sun, 18 Feb 2024 12:02:39 -0800 (PST)
Received-SPF: pass (google.com: domain of mig@mirrorimagegaming.com designates 143.198.55.208 as permitted sender) client-ip=143.198.55.208;
Received: by mail.mirrorimagegaming.com (Postfix, from userid 0)
	id A859D7E03E; Sun, 18 Feb 2024 20:04:00 +0000 (UTC)
From: MiG <mig@mirrorimagegaming.com>
To: <abuse@digitalocean.com>
Subject: Bad/Threat Actor
User-Agent: mail (GNU Mailutils 3.14)
Date: Sun, 18 Feb 2024 20:04:00 +0000
Message-Id: <20240218200400.A859D7E03E@mail.mirrorimagegaming.com>
X-Original-Sender: mig@mirrorimagegaming.com
X-Original-Authentication-Results: mx.google.com;       spf=pass (google.com:
 domain of mig@mirrorimagegaming.com designates 143.198.55.208 as permitted
 sender) smtp.mailfrom=mig@mirrorimagegaming.com
Precedence: list
Mailing-list: list abuse@digitalocean.com; contact abuse+owners@digitalocean.com
List-ID: <abuse.digitalocean.com>
X-Spam-Checked-In-Group: abuse@digitalocean.com
X-Google-Group-Id: 331087551970
List-Post: <https://groups.google.com/a/digitalocean.com/group/abuse/post>, <mailto:abuse@digitalocean.com>
List-Help: <https://support.google.com/a/digitalocean.com/bin/topic.py?topic=25838>,
 <mailto:abuse+help@digitalocean.com>
List-Archive: <https://groups.google.com/a/digitalocean.com/group/abuse/>
List-Unsubscribe: <mailto:googlegroups-manage+331087551970+unsubscribe@googlegroups.com>,
 <https://groups.google.com/a/digitalocean.com/group/abuse/subscribe>

Mirror Image Gaming - Automated Report
Included is a report for the bad/threat actor: 167.172.57.35
mirrorimagegaming.com
Server Time Zone: UTC
Feb 18 19:41:30 - 167.172.57.35 → 143.198.55.208 TCP 80 [TCP Retransmission] [TCP Port numbers reused] 41710 → 22 [SYN] Seq=0 Win=64240 Len=0 MSS=1460 SACK_PERM=1 TSval=2231437608 TSecr=0 WS=128
Feb 18 19:42:14 - 167.172.57.35 → 143.198.55.208 TCP 80 53020 → 22 [SYN] Seq=0 Win=64240 Len=0 MSS=1460 SACK_PERM=1 TSval=2231480029 TSecr=0 WS=128
Feb 18 19:42:14 - 167.172.57.35 → 143.198.55.208 TCP 80 [TCP Retransmission] [TCP Port numbers reused] 53020 → 22 [SYN] Seq=0 Win=64240 Len=0 MSS=1460 SACK_PERM=1 TSval=2231481032 TSecr=0 WS=128
Feb 18 19:42:19 - 167.172.57.35 → 143.198.55.208 TCP 80 [TCP Retransmission] [TCP Port numbers reused] 53020 → 22 [SYN] Seq=0 Win=64240 Len=0 MSS=1460 SACK_PERM=1 TSval=2231483048 TSecr=0 WS=128
Feb 18 19:42:19 - 167.172.57.35 → 143.198.55.208 TCP 80 [TCP Retransmission] [TCP Port numbers reused] 53020 → 22 [SYN] Seq=0 Win=64240 Len=0 MSS=1460 SACK_PERM=1 TSval=2231487272 TSecr=0 WS=128
Feb 18 19:43:17 - 167.172.57.35 → 143.198.55.208 TCP 80 49360 → 22 [SYN] Seq=0 Win=64240 Len=0 MSS=1460 SACK_PERM=1 TSval=2231530270 TSecr=0 WS=128
Feb 18 19:43:17 - 167.172.57.35 → 143.198.55.208 TCP 80 [TCP Retransmission] [TCP Port numbers reused] 49360 → 22 [SYN] Seq=0 Win=64240 Len=0 MSS=1460 SACK_PERM=1 TSval=2231531272 TSecr=0 WS=128
Feb 18 19:43:17 - 167.172.57.35 → 143.198.55.208 TCP 80 [TCP Retransmission] [TCP Port numbers reused] 49360 → 22 [SYN] Seq=0 Win=64240 Len=0 MSS=1460 SACK_PERM=1 TSval=2231533288 TSecr=0 WS=128
Feb 18 19:43:17 - 167.172.57.35 → 143.198.55.208 TCP 80 [TCP Retransmission] [TCP Port numbers reused] 49360 → 22 [SYN] Seq=0 Win=64240 Len=0 MSS=1460 SACK_PERM=1 TSval=2231537448 TSecr=0 WS=128
Feb 18 19:43:59 - 167.172.57.35 → 143.198.55.208 TCP 80 52796 → 22 [SYN] Seq=0 Win=64240 Len=0 MSS=1460 SACK_PERM=1 TSval=2231578694 TSecr=0 WS=128
Feb 18 19:43:59 - 167.172.57.35 → 143.198.55.208 TCP 80 [TCP Retransmission] [TCP Port numbers reused] 52796 → 22 [SYN] Seq=0 Win=64240 Len=0 MSS=1460 SACK_PERM=1 TSval=2231579720 TSecr=0 WS=128
Feb 18 19:43:59 - 167.172.57.35 → 143.198.55.208 TCP 80 [TCP Retransmission] [TCP Port numbers reused] 52796 → 22 [SYN] Seq=0 Win=64240 Len=0 MSS=1460 SACK_PERM=1 TSval=2231581736 TSecr=0 WS=128
Feb 18 19:43:59 - 167.172.57.35 → 143.198.55.208 TCP 80 [TCP Retransmission] [TCP Port numbers reused] 52796 → 22 [SYN] Seq=0 Win=64240 Len=0 MSS=1460 SACK_PERM=1 TSval=2231585832 TSecr=0 WS=128
Feb 18 19:44:44 - 167.172.57.35 → 143.198.55.208 TCP 80 44870 → 22 [SYN] Seq=0 Win=64240 Len=0 MSS=1460 SACK_PERM=1 TSval=2231631946 TSecr=0 WS=128
Feb 18 19:44:47 - 167.172.57.35 → 143.198.55.208 TCP 80 [TCP Retransmission] [TCP Port numbers reused] 44870 → 22 [SYN] Seq=0 Win=64240 Len=0 MSS=1460 SACK_PERM=1 TSval=2231632968 TSecr=0 WS=128
Feb 18 19:44:47 - 167.172.57.35 → 143.198.55.208 TCP 80 [TCP Retransmission] [TCP Port numbers reused] 44870 → 22 [SYN] Seq=0 Win=64240 Len=0 MSS=1460 SACK_PERM=1 TSval=2231634984 TSecr=0 WS=128
Feb 18 19:44:58 - 167.172.57.35 → 143.198.55.208 TCP 80 [TCP Retransmission] [TCP Port numbers reused] 44870 → 22 [SYN] Seq=0 Win=64240 Len=0 MSS=1460 SACK_PERM=1 TSval=2231639080 TSecr=0 WS=128
Feb 18 19:45:46 - 167.172.57.35 → 143.198.55.208 TCP 80 54438 → 22 [SYN] Seq=0 Win=64240 Len=0 MSS=1460 SACK_PERM=1 TSval=2231681894 TSecr=0 WS=128
Feb 18 19:45:46 - 167.172.57.35 → 143.198.55.208 TCP 80 [TCP Retransmission] [TCP Port numbers reused] 54438 → 22 [SYN] Seq=0 Win=64240 Len=0 MSS=1460 SACK_PERM=1 TSval=2231682920 TSecr=0 WS=128
Feb 18 19:45:46 - 167.172.57.35 → 143.198.55.208 TCP 80 [TCP Retransmission] [TCP Port numbers reused] 54438 → 22 [SYN] Seq=0 Win=64240 Len=0 MSS=1460 SACK_PERM=1 TSval=2231684936 TSecr=0 WS=128
Feb 18 19:45:46 - 167.172.57.35 → 143.198.55.208 TCP 80 [TCP Retransmission] [TCP Port numbers reused] 54438 → 22 [SYN] Seq=0 Win=64240 Len=0 MSS=1460 SACK_PERM=1 TSval=2231689000 TSecr=0 WS=128
Feb 18 19:46:38 - 167.172.57.35 → 143.198.55.208 TCP 80 42084 → 22 [SYN] Seq=0 Win=64240 Len=0 MSS=1460 SACK_PERM=1 TSval=2231734289 TSecr=0 WS=128
Feb 18 19:46:38 - 167.172.57.35 → 143.198.55.208 TCP 80 [TCP Retransmission] [TCP Port numbers reused] 42084 → 22 [SYN] Seq=0 Win=64240 Len=0 MSS=1460 SACK_PERM=1 TSval=2231735304 TSecr=0 WS=128
Feb 18 19:46:38 - 167.172.57.35 → 143.198.55.208 TCP 80 [TCP Retransmission] [TCP Port numbers reused] 42084 → 22 [SYN] Seq=0 Win=64240 Len=0 MSS=1460 SACK_PERM=1 TSval=2231737320 TSecr=0 WS=128
Feb 18 19:46:38 - 167.172.57.35 → 143.198.55.208 TCP 80 [TCP Retransmission] [TCP Port numbers reused] 42084 → 22 [SYN] Seq=0 Win=64240 Len=0 MSS=1460 SACK_PERM=1 TSval=2231741480 TSecr=0 WS=128
Feb 18 19:47:30 - 167.172.57.35 → 143.198.55.208 TCP 80 54782 → 22 [SYN] Seq=0 Win=64240 Len=0 MSS=1460 SACK_PERM=1 TSval=2231789147 TSecr=0 WS=128
Feb 18 19:47:30 - 167.172.57.35 → 143.198.55.208 TCP 80 [TCP Retransmission] [TCP Port numbers reused] 54782 → 22 [SYN] Seq=0 Win=64240 Len=0 MSS=1460 SACK_PERM=1 TSval=2231790152 TSecr=0 WS=128
Feb 18 19:47:30 - 167.172.57.35 → 143.198.55.208 TCP 80 [TCP Retransmission] [TCP Port numbers reused] 54782 → 22 [SYN] Seq=0 Win=64240 Len=0 MSS=1460 SACK_PERM=1 TSval=2231792168 TSecr=0 WS=128
Feb 18 19:47:30 - 167.172.57.35 → 143.198.55.208 TCP 80 [TCP Retransmission] [TCP Port numbers reused] 54782 → 22 [SYN] Seq=0 Win=64240 Len=0 MSS=1460 SACK_PERM=1 TSval=2231796264 TSecr=0 WS=128
Feb 18 19:48:13 - 167.172.57.35 → 143.198.55.208 TCP 80 36804 → 22 [SYN] Seq=0 Win=64240 Len=0 MSS=1460 SACK_PERM=1 TSval=2231841574 TSecr=0 WS=128
Feb 18 19:48:18 - 167.172.57.35 → 143.198.55.208 TCP 80 [TCP Retransmission] [TCP Port numbers reused] 36804 → 22 [SYN] Seq=0 Win=64240 Len=0 MSS=1460 SACK_PERM=1 TSval=2231842600 TSecr=0 WS=128
Feb 18 19:48:18 - 167.172.57.35 → 143.198.55.208 TCP 80 [TCP Retransmission] [TCP Port numbers reused] 36804 → 22 [SYN] Seq=0 Win=64240 Len=0 MSS=1460 SACK_PERM=1 TSval=2231844616 TSecr=0 WS=128
Feb 18 19:48:21 - 167.172.57.35 → 143.198.55.208 TCP 80 [TCP Retransmission] [TCP Port numbers reused] 36804 → 22 [SYN] Seq=0 Win=64240 Len=0 MSS=1460 SACK_PERM=1 TSval=2231848744 TSecr=0 WS=128
Feb 18 19:49:05 - 167.172.57.35 → 143.198.55.208 TCP 80 52894 → 22 [SYN] Seq=0 Win=64240 Len=0 MSS=1460 SACK_PERM=1 TSval=2231893058 TSecr=0 WS=128
Feb 18 19:49:05 - 167.172.57.35 → 143.198.55.208 TCP 80 [TCP Retransmission] [TCP Port numbers reused] 52894 → 22 [SYN] Seq=0 Win=64240 Len=0 MSS=1460 SACK_PERM=1 TSval=2231894088 TSecr=0 WS=128
Feb 18 19:49:11 - 167.172.57.35 → 143.198.55.208 TCP 80 [TCP Retransmission] [TCP Port numbers reused] 52894 → 22 [SYN] Seq=0 Win=64240 Len=0 MSS=1460 SACK_PERM=1 TSval=2231896104 TSecr=0 WS=128
Feb 18 19:49:16 - 167.172.57.35 → 143.198.55.208 TCP 80 [TCP Retransmission] [TCP Port numbers reused] 52894 → 22 [SYN] Seq=0 Win=64240 Len=0 MSS=1460 SACK_PERM=1 TSval=2231900200 TSecr=0 WS=128
Feb 18 19:49:59 - 167.172.57.35 → 143.198.55.208 TCP 80 45518 → 22 [SYN] Seq=0 Win=64240 Len=0 MSS=1460 SACK_PERM=1 TSval=2231948218 TSecr=0 WS=128
Feb 18 19:50:16 - 167.172.57.35 → 143.198.55.208 TCP 80 [TCP Retransmission] [TCP Port numbers reused] 45518 → 22 [SYN] Seq=0 Win=64240 Len=0 MSS=1460 SACK_PERM=1 TSval=2231949224 TSecr=0 WS=128
Feb 18 19:50:16 - 167.172.57.35 → 143.198.55.208 TCP 80 [TCP Retransmission] [TCP Port numbers reused] 45518 → 22 [SYN] Seq=0 Win=64240 Len=0 MSS=1460 SACK_PERM=1 TSval=2231951240 TSecr=0 WS=128
Feb 18 19:50:16 - 167.172.57.35 → 143.198.55.208 TCP 80 [TCP Retransmission] [TCP Port numbers reused] 45518 → 22 [SYN] Seq=0 Win=64240 Len=0 MSS=1460 SACK_PERM=1 TSval=2231955496 TSecr=0 WS=128
Feb 18 19:51:05 - 167.172.57.35 → 143.198.55.208 TCP 80 49496 → 22 [SYN] Seq=0 Win=64240 Len=0 MSS=1460 SACK_PERM=1 TSval=2232002262 TSecr=0 WS=128
Feb 18 19:51:05 - 167.172.57.35 → 143.198.55.208 TCP 80 [TCP Retransmission] [TCP Port numbers reused] 49496 → 22 [SYN] Seq=0 Win=64240 Len=0 MSS=1460 SACK_PERM=1 TSval=2232003272 TSecr=0 WS=128
Feb 18 19:51:05 - 167.172.57.35 → 143.198.55.208 TCP 80 [TCP Retransmission] [TCP Port numbers reused] 49496 → 22 [SYN] Seq=0 Win=64240 Len=0 MSS=1460 SACK_PERM=1 TSval=2232005288 TSecr=0 WS=128
Feb 18 19:51:05 - 167.172.57.35 → 143.198.55.208 TCP 80 [TCP Retransmission] [TCP Port numbers reused] 49496 → 22 [SYN] Seq=0 Win=64240 Len=0 MSS=1460 SACK_PERM=1 TSval=2232009512 TSecr=0 WS=128
Feb 18 19:52:05 - 167.172.57.35 → 143.198.55.208 TCP 80 56776 → 22 [SYN] Seq=0 Win=64240 Len=0 MSS=1460 SACK_PERM=1 TSval=2232057387 TSecr=0 WS=128
Feb 18 19:52:05 - 167.172.57.35 → 143.198.55.208 TCP 80 [TCP Retransmission] [TCP Port numbers reused] 56776 → 22 [SYN] Seq=0 Win=64240 Len=0 MSS=1460 SACK_PERM=1 TSval=2232058408 TSecr=0 WS=128
Feb 18 19:52:05 - 167.172.57.35 → 143.198.55.208 TCP 80 [TCP Retransmission] [TCP Port numbers reused] 56776 → 22 [SYN] Seq=0 Win=64240 Len=0 MSS=1460 SACK_PERM=1 TSval=2232060424 TSecr=0 WS=128
Feb 18 19:52:05 - 167.172.57.35 → 143.198.55.208 TCP 80 [TCP Retransmission] [TCP Port numbers reused] 56776 → 22 [SYN] Seq=0 Win=64240 Len=0 MSS=1460 SACK_PERM=1 TSval=2232064552 TSecr=0 WS=128
Feb 18 19:52:49 - 167.172.57.35 → 143.198.55.208 TCP 80 53196 → 22 [SYN] Seq=0 Win=64240 Len=0 MSS=1460 SACK_PERM=1 TSval=2232111042 TSecr=0 WS=128
Feb 18 19:52:49 - 167.172.57.35 → 143.198.55.208 TCP 80 [TCP Retransmission] [TCP Port numbers reused] 53196 → 22 [SYN] Seq=0 Win=64240 Len=0 MSS=1460 SACK_PERM=1 TSval=2232112072 TSecr=0 WS=128
Feb 18 19:52:49 - 167.172.57.35 → 143.198.55.208 TCP 80 [TCP Retransmission] [TCP Port numbers reused] 53196 → 22 [SYN] Seq=0 Win=64240 Len=0 MSS=1460 SACK_PERM=1 TSval=2232114088 TSecr=0 WS=128
Feb 18 19:53:15 - 167.172.57.35 → 143.198.55.208 TCP 80 [TCP Retransmission] [TCP Port numbers reused] 53196 → 22 [SYN] Seq=0 Win=64240 Len=0 MSS=1460 SACK_PERM=1 TSval=2232118312 TSecr=0 WS=128
Feb 18 19:54:07 - 167.172.57.35 → 143.198.55.208 TCP 80 55636 → 22 [SYN] Seq=0 Win=64240 Len=0 MSS=1460 SACK_PERM=1 TSval=2232165302 TSecr=0 WS=128
Feb 18 19:54:07 - 167.172.57.35 → 143.198.55.208 TCP 80 [TCP Retransmission] [TCP Port numbers reused] 55636 → 22 [SYN] Seq=0 Win=64240 Len=0 MSS=1460 SACK_PERM=1 TSval=2232166312 TSecr=0 WS=128
Feb 18 19:54:07 - 167.172.57.35 → 143.198.55.208 TCP 80 [TCP Retransmission] [TCP Port numbers reused] 55636 → 22 [SYN] Seq=0 Win=64240 Len=0 MSS=1460 SACK_PERM=1 TSval=2232168328 TSecr=0 WS=128
Feb 18 19:54:07 - 167.172.57.35 → 143.198.55.208 TCP 80 [TCP Retransmission] [TCP Port numbers reused] 55636 → 22 [SYN] Seq=0 Win=64240 Len=0 MSS=1460 SACK_PERM=1 TSval=2232172584 TSecr=0 WS=128
Feb 18 19:54:33 - 167.172.57.35 → 143.198.55.208 TCP 80 45174 → 22 [SYN] Seq=0 Win=64240 Len=0 MSS=1460 SACK_PERM=1 TSval=2232215919 TSecr=0 WS=128
Feb 18 19:54:33 - 167.172.57.35 → 143.198.55.208 TCP 80 [TCP Retransmission] [TCP Port numbers reused] 45174 → 22 [SYN] Seq=0 Win=64240 Len=0 MSS=1460 SACK_PERM=1 TSval=2232216936 TSecr=0 WS=128
Feb 18 19:54:33 - 167.172.57.35 → 143.198.55.208 TCP 80 [TCP Retransmission] [TCP Port numbers reused] 45174 → 22 [SYN] Seq=0 Win=64240 Len=0 MSS=1460 SACK_PERM=1 TSval=2232218952 TSecr=0 WS=128
Feb 18 19:54:39 - 167.172.57.35 → 143.198.55.208 TCP 80 [TCP Retransmission] [TCP Port numbers reused] 45174 → 22 [SYN] Seq=0 Win=64240 Len=0 MSS=1460 SACK_PERM=1 TSval=2232223016 TSecr=0 WS=128
Feb 18 19:55:36 - 167.172.57.35 → 143.198.55.208 TCP 80 44476 → 22 [SYN] Seq=0 Win=64240 Len=0 MSS=1460 SACK_PERM=1 TSval=2232269227 TSecr=0 WS=128
Feb 18 19:55:36 - 167.172.57.35 → 143.198.55.208 TCP 80 [TCP Retransmission] [TCP Port numbers reused] 44476 → 22 [SYN] Seq=0 Win=64240 Len=0 MSS=1460 SACK_PERM=1 TSval=2232270248 TSecr=0 WS=128
Feb 18 19:55:36 - 167.172.57.35 → 143.198.55.208 TCP 80 [TCP Retransmission] [TCP Port numbers reused] 44476 → 22 [SYN] Seq=0 Win=64240 Len=0 MSS=1460 SACK_PERM=1 TSval=2232272264 TSecr=0 WS=128
Feb 18 19:55:36 - 167.172.57.35 → 143.198.55.208 TCP 80 [TCP Retransmission] [TCP Port numbers reused] 44476 → 22 [SYN] Seq=0 Win=64240 Len=0 MSS=1460 SACK_PERM=1 TSval=2232276520 TSecr=0 WS=128
Feb 18 19:56:11 - 167.172.57.35 → 143.198.55.208 TCP 80 35476 → 22 [SYN] Seq=0 Win=64240 Len=0 MSS=1460 SACK_PERM=1 TSval=2232318738 TSecr=0 WS=128
Feb 18 19:56:21 - 167.172.57.35 → 143.198.55.208 TCP 80 [TCP Retransmission] [TCP Port numbers reused] 35476 → 22 [SYN] Seq=0 Win=64240 Len=0 MSS=1460 SACK_PERM=1 TSval=2232319752 TSecr=0 WS=128
Feb 18 19:56:21 - 167.172.57.35 → 143.198.55.208 TCP 80 [TCP Retransmission] [TCP Port numbers reused] 35476 → 22 [SYN] Seq=0 Win=64240 Len=0 MSS=1460 SACK_PERM=1 TSval=2232321768 TSecr=0 WS=128
Feb 18 19:56:21 - 167.172.57.35 → 143.198.55.208 TCP 80 [TCP Retransmission] [TCP Port numbers reused] 35476 → 22 [SYN] Seq=0 Win=64240 Len=0 MSS=1460 SACK_PERM=1 TSval=2232325928 TSecr=0 WS=128
Feb 18 19:57:29 - 167.172.57.35 → 143.198.55.208 TCP 80 44498 → 22 [SYN] Seq=0 Win=64240 Len=0 MSS=1460 SACK_PERM=1 TSval=2232370587 TSecr=0 WS=128
Feb 18 19:57:29 - 167.172.57.35 → 143.198.55.208 TCP 80 [TCP Retransmission] [TCP Port numbers reused] 44498 → 22 [SYN] Seq=0 Win=64240 Len=0 MSS=1460 SACK_PERM=1 TSval=2232371592 TSecr=0 WS=128
Feb 18 19:57:29 - 167.172.57.35 → 143.198.55.208 TCP 80 [TCP Retransmission] [TCP Port numbers reused] 44498 → 22 [SYN] Seq=0 Win=64240 Len=0 MSS=1460 SACK_PERM=1 TSval=2232373608 TSecr=0 WS=128
Feb 18 19:57:29 - 167.172.57.35 → 143.198.55.208 TCP 80 [TCP Retransmission] [TCP Port numbers reused] 44498 → 22 [SYN] Seq=0 Win=64240 Len=0 MSS=1460 SACK_PERM=1 TSval=2232377640 TSecr=0 WS=128
Feb 18 19:58:01 - 167.172.57.35 → 143.198.55.208 TCP 80 57254 → 22 [SYN] Seq=0 Win=64240 Len=0 MSS=1460 SACK_PERM=1 TSval=2232422458 TSecr=0 WS=128
Feb 18 19:58:01 - 167.172.57.35 → 143.198.55.208 TCP 80 [TCP Retransmission] [TCP Port numbers reused] 57254 → 22 [SYN] Seq=0 Win=64240 Len=0 MSS=1460 SACK_PERM=1 TSval=2232423464 TSecr=0 WS=128
Feb 18 19:58:01 - 167.172.57.35 → 143.198.55.208 TCP 80 [TCP Retransmission] [TCP Port numbers reused] 57254 → 22 [SYN] Seq=0 Win=64240 Len=0 MSS=1460 SACK_PERM=1 TSval=2232425480 TSecr=0 WS=128
Feb 18 19:58:17 - 167.172.57.35 → 143.198.55.208 TCP 80 [TCP Retransmission] [TCP Port numbers reused] 57254 → 22 [SYN] Seq=0 Win=64240 Len=0 MSS=1460 SACK_PERM=1 TSval=2232429608 TSecr=0 WS=128
Feb 18 19:58:49 - 167.172.57.35 → 143.198.55.208 TCP 80 42830 → 22 [SYN] Seq=0 Win=64240 Len=0 MSS=1460 SACK_PERM=1 TSval=2232476786 TSecr=0 WS=128
Feb 18 19:59:10 - 167.172.57.35 → 143.198.55.208 TCP 80 [TCP Retransmission] [TCP Port numbers reused] 42830 → 22 [SYN] Seq=0 Win=64240 Len=0 MSS=1460 SACK_PERM=1 TSval=2232477800 TSecr=0 WS=128
Feb 18 19:59:10 - 167.172.57.35 → 143.198.55.208 TCP 80 [TCP Retransmission] [TCP Port numbers reused] 42830 → 22 [SYN] Seq=0 Win=64240 Len=0 MSS=1460 SACK_PERM=1 TSval=2232479816 TSecr=0 WS=128
Feb 18 19:59:10 - 167.172.57.35 → 143.198.55.208 TCP 80 [TCP Retransmission] [TCP Port numbers reused] 42830 → 22 [SYN] Seq=0 Win=64240 Len=0 MSS=1460 SACK_PERM=1 TSval=2232483880 TSecr=0 WS=128
Feb 18 20:00:17 - 167.172.57.35 → 143.198.55.208 TCP 80 49930 → 22 [SYN] Seq=0 Win=64240 Len=0 MSS=1460 SACK_PERM=1 TSval=2232533902 TSecr=0 WS=128
Feb 18 20:00:17 - 167.172.57.35 → 143.198.55.208 TCP 80 [TCP Retransmission] [TCP Port numbers reused] 49930 → 22 [SYN] Seq=0 Win=64240 Len=0 MSS=1460 SACK_PERM=1 TSval=2232534920 TSecr=0 WS=128
Feb 18 20:00:17 - 167.172.57.35 → 143.198.55.208 TCP 80 [TCP Retransmission] [TCP Port numbers reused] 49930 → 22 [SYN] Seq=0 Win=64240 Len=0 MSS=1460 SACK_PERM=1 TSval=2232536936 TSecr=0 WS=128
Feb 18 20:00:17 - 167.172.57.35 → 143.198.55.208 TCP 80 [TCP Retransmission] [TCP Port numbers reused] 49930 → 22 [SYN] Seq=0 Win=64240 Len=0 MSS=1460 SACK_PERM=1 TSval=2232540968 TSecr=0 WS=128
Feb 18 20:01:11 - 167.172.57.35 → 143.198.55.208 TCP 80 57512 → 22 [SYN] Seq=0 Win=64240 Len=0 MSS=1460 SACK_PERM=1 TSval=2232590424 TSecr=0 WS=128
Feb 18 20:01:11 - 167.172.57.35 → 143.198.55.208 TCP 80 [TCP Retransmission] [TCP Port numbers reused] 57512 → 22 [SYN] Seq=0 Win=64240 Len=0 MSS=1460 SACK_PERM=1 TSval=2232591432 TSecr=0 WS=128
Feb 18 20:01:11 - 167.172.57.35 → 143.198.55.208 TCP 80 [TCP Retransmission] [TCP Port numbers reused] 57512 → 22 [SYN] Seq=0 Win=64240 Len=0 MSS=1460 SACK_PERM=1 TSval=2232593448 TSecr=0 WS=128
Feb 18 20:01:11 - 167.172.57.35 → 143.198.55.208 TCP 80 [TCP Retransmission] [TCP Port numbers reused] 57512 → 22 [SYN] Seq=0 Win=64240 Len=0 MSS=1460 SACK_PERM=1 TSval=2232597544 TSecr=0 WS=128
Feb 18 20:01:39 - 167.172.57.35 → 143.198.55.208 TCP 80 45084 → 22 [SYN] Seq=0 Win=64240 Len=0 MSS=1460 SACK_PERM=1 TSval=2232642200 TSecr=0 WS=128
Feb 18 20:01:39 - 167.172.57.35 → 143.198.55.208 TCP 80 [TCP Retransmission] [TCP Port numbers reused] 45084 → 22 [SYN] Seq=0 Win=64240 Len=0 MSS=1460 SACK_PERM=1 TSval=2232643208 TSecr=0 WS=128
Feb 18 20:01:39 - 167.172.57.35 → 143.198.55.208 TCP 80 [TCP Retransmission] [TCP Port numbers reused] 45084 → 22 [SYN] Seq=0 Win=64240 Len=0 MSS=1460 SACK_PERM=1 TSval=2232645224 TSecr=0 WS=128
Feb 18 20:01:43 - 167.172.57.35 → 143.198.55.208 TCP 80 [TCP Retransmission] [TCP Port numbers reused] 45084 → 22 [SYN] Seq=0 Win=64240 Len=0 MSS=1460 SACK_PERM=1 TSval=2232649256 TSecr=0 WS=128
Feb 18 20:03:06 - 167.172.57.35 → 143.198.55.208 TCP 80 59966 → 22 [SYN] Seq=0 Win=64240 Len=0 MSS=1460 SACK_PERM=1 TSval=2232729927 TSecr=0 WS=128
Feb 18 20:03:06 - 167.172.57.35 → 143.198.55.208 TCP 80 [TCP Retransmission] [TCP Port numbers reused] 59966 → 22 [SYN] Seq=0 Win=64240 Len=0 MSS=1460 SACK_PERM=1 TSval=2232730952 TSecr=0 WS=128
Feb 18 20:03:06 - 167.172.57.35 → 143.198.55.208 TCP 80 [TCP Retransmission] [TCP Port numbers reused] 59966 → 22 [SYN] Seq=0 Win=64240 Len=0 MSS=1460 SACK_PERM=1 TSval=2232732968 TSecr=0 WS=128
Feb 18 20:03:15 - 167.172.57.35 → 143.198.55.208 TCP 80 [TCP Retransmission] [TCP Port numbers reused] 59966 → 22 [SYN] Seq=0 Win=64240 Len=0 MSS=1460 SACK_PERM=1 TSval=2232737064 TSecr=0 WS=128
Feb 18 20:04:00 - 167.172.57.35 → 143.198.55.208 TCP 80 48032 → 22 [SYN] Seq=0 Win=64240 Len=0 MSS=1460 SACK_PERM=1 TSval=2232783467 TSecr=0 WS=128
Feb 18 20:04:00 - 167.172.57.35 → 143.198.55.208 TCP 80 [TCP Retransmission] [TCP Port numbers reused] 48032 → 22 [SYN] Seq=0 Win=64240 Len=0 MSS=1460 SACK_PERM=1 TSval=2232784488 TSecr=0 WS=128
Feb 18 20:04:00 - 167.172.57.35 → 143.198.55.208 TCP 80 [TCP Retransmission] [TCP Port numbers reused] 48032 → 22 [SYN] Seq=0 Win=64240 Len=0 MSS=1460 SACK_PERM=1 TSval=2232786504 TSecr=0 WS=128
